293	θυγατέρες Βορέαο, καὶ ἄρσενες οἳ τότʼ ἄριστοι 
294	ἠιθέων· οὐδʼ οἵ γε παλιμπετὲς οἴκαδʼ ἵκοντο, 
295	εὔμοιροι δʼ ἐγένοντο, καὶ ἀκλέες οὔποτʼ ἐκεῖνοι. 
296	ἦ τοι Δηλιάδες μέν, ὅτʼ εὐήχης ὑμέναιος 
297	ἤθεα κουράων μορμύσσεται, ἥλικα χαίτην 
298	παρθενικαῖς, παῖδες δὲ θέρος τὸ πρῶτον ἰούλων 
299	ἄρσενες ἠιθέοισιν ἀπαρχόμενοι φορέουσιν. 
300	Ἀστερίη θυόεσσα, σὲ μὲν περί τʼ ἀμφί τε νῆσοι 
301	κύκλον ἐποιήσαντο καὶ ὡς χορὸν ἀμφεβάλοντο· 
302	οὔτε σιωπηλὴν οὔτʼ ἄψοφον οὖλος ἐθείραις 
303	ἕσπερος, ἀλλʼ αἰεί σε καταβλέπει ἀμφιβόητον. 
304	οἳ μὲν ὑπαείδουσι νόμον Λυκίοιο γέροντος, 
305	ὅν τοι ἀπὸ Ξάνθοιο θεοπρόπος ἤγαγεν Ὠλήν· 
306	αἳ δὲ ποδὶ πλήσσουσι χορίτιδες ἀσφαλὲς οὖδας. 
307	δὴ τότε καὶ στεφάνοισι βαρύνεται ἱρὸν ἄγαλμα 
308	Κύπριδος ἀρχαίης ἀριήκοον, ἥν ποτε Θησεύς 
309	εἵσατο σὺν παίδεσσιν, ὅτε Κρήτηθεν ἀνέπλει.
310	οἳ χαλεπὸν μύκημα καὶ ἄγριον υἷα φυγόντες 
311	Πασιφάης καὶ γναμπτὸν ἕδος σκολιοῦ λαβυρίνθου 
312	πότνια σὸν περὶ βωμὸν ἐγειρομένου κιθαρισμοῦ 
313	κύκλιον ὠρχήσαντο, χοροῦ δʼ ἡγήσατο Θησεύς. 
314	ἔνθεν ἀειζώοντα θεωρίδος ἱερὰ Φοίβωι 
315	Κεκροπίδαι πέμπουσι, τοπήια νηὸς ἐκείνης. 
316	Ἀστερίη πολύβωμε πολύλλιτε, τίς δέ σε ναύτης 
317	ἔμπορος Αἰγαίοιο παρήλυθε νηὶ θεούσηι; 
318	οὐχ ούτω μεγάλοι μιν ἐπιπνείουσιν ἀῆται, 
319	χρειὼ δʼ ὅττι τάχιστον ἄγει πλόον, ἀλλὰ τὰ λαίφη 
320	ὠκέες ἐστείλαντο καὶ οὐ πάλιν αὖτις ἔβησαν, 
321	πρὶν μεγάλη σέο βωμὸν ὑπὸ πληγῆισιν ἑλίξαι 
322	ῥησσόμενον καὶ πρέμνον ὀδακτάσαι ἁγνὸν ἐλαίης 
323	χεῖρας ἀποστρέψαντας· ἃ Δηλιὰς εὕρετο νύμφη 
324	παίγνια κουρίζοντι καὶ Ἀπόλλωνι γελαστύν. 
325	ἱστίη ὦ νήσων εὐέστιε χαῖρε μὲν αὐτή, 
326	χαίροι δʼ Ἀπόλλων τε καὶ ἣν ἐλοχεύσαο Λητώ.
