40	ἀλλὰ γὰρ ὅπλα τῶν πολεμίων τοσαῦτα τοσαῦτα add. Reiske ἐσκύλευσαν ὅσα περ ὑμῶν ἀφείλοντο, ἀλλὰ τείχη τοιαῦτα εἷλον οἷα τῆς ἑαυτῶν πατρίδος κατέσκαψαν; οἵτινες καὶ τὰ περὶ τὴν Ἀττικὴν φρούρια καθεῖλον, καὶ ὑμῖν ἐδήλωσαν ὅτι οὐδὲ τὸν Πειραιᾶ Λακεδαιμονίων προσταττόντων περιεῖλον, ἀλλʼ ὅτι ἑαυτοῖς ὅτι ἑαυτοῖς Sluiter: οῖς αὐτοῖς . τὴν ἀρχὴν οὕτω βεβαιοτέραν ἐνόμιζον εἶναι. 
41	πολλάκις οὖν ἐθαύμασα τῆς τόλμης τῶν λεγόντων ὑπὲρ αὐτοῦ, αὐτοῦ Dobree: αὐτῶν MSS. πλὴν ὅταν ἐνθυμηθῶ ὅτι τῶν αὐτῶν ἐστιν αὐτούς τε πάντα τὰ κακὰ ἐργάζεσθαι καὶ τοὺς τοιούτους ἐπαινεῖν. 
42	οὐ γὰρ νῦν πρῶτον τῷ ὑμετέρῳ πλήθει τὰ ἐναντία ἔπραξεν, ἀλλὰ καὶ ἐπὶ τῶν τετρακοσίων ἐν τῷ στρατοπέδῳ ὀλιγαρχίαν καθιστὰς ἔφευγεν ἐξ Ἑλλησπόντου τριήραρχος καταλιπὼν τὴν ναῦν, μετὰ Ἰατροκλέους καὶ ἑτέρων, ὧν τὰ ὀνόματα οὐδὲν δέομαι λέγειν. ἀφικόμενος δὲ δεῦρο τἀναντία τοῖς βουλομένοις δημοκρατίαν εἶναι ἔπραττε. καὶ τούτων μάρτυρας ὑμῖν παρέξομαι. 
43	Μάρτυρες τὸν μὲν τοίνυν μεταξὺ βίον αὐτοῦ παρήσω· ἐπειδὴ δὲ ἡ ναυμαχία καὶ ἡ συμφορὰ τῇ πόλει ἐγένετο, δημοκρατίας ἔτι οὔσης, ὅθεν τῆς στάσεως ἦρξαν, πέντε ἄνδρες ἔφοροι κατέστησαν ὑπὸ τῶν καλουμένων ἑταίρων, συναγωγεῖς μὲν τῶν πολιτῶν ἄρχοντες δὲ τῶν συνωμοτῶν, ἐναντία δὲ τῷ ὑμετέρῳ πλήθει πράττοντες· ὧν Ἐρατοσθένης καὶ Κριτίας ἦσαν. 
44	οὗτοι δὲ φυλάρχους τε ἐπὶ τὰς φυλὰς φυλὰς Taylor: φυλακὰς MSS. κατέστησαν, καὶ ὅ τι δέοι χειροτονεῖσθαι καὶ οὕστινας χρείη χρείη Bekker: χρὴ MSS. ἄρχειν παρήγγελλον, καὶ εἴ τι ἄλλο πράττειν βούλοιντο, κύριοι ἦσαν· οὕτως οὐχ ὑπὸ τῶν πολεμίων μόνον ἀλλὰ καὶ ὑπὸ τούτων πολιτῶν ὄντων ἐπεβουλεύεσθε ὅπως μήτʼ ἀγαθὸν μηδὲν ψηφιεῖσθε Ψηφιεῖσθε Cobet: Ψηφίσεσθε, ψηφισεσθε MSS. πολλῶν τε ἐνδεεῖς ἔσεσθε. 
45	τοῦτο γὰρ καλῶς καλῶς Frohberger: καὶ MSS. ἠπίσταντο, ὅτι ἄλλως μὲν οὐχ οἷοί τε ἔσονται περιγενέσθαι, κακῶς δὲ πραττόντων δυνήσονται· καὶ ὑμᾶς ἡγοῦντο τῶν παρόντων κακῶν ἐπιθυμοῦντας ἀπαλλαγῆναι περὶ τῶν μελλόντων οὐκ ἐνθυμήσεσθαι. 
46	ὡς τοίνυν τῶν ἐφόρων ἐγένετο, μάρτυρας ὑμῖν παρέξομαι, οὐ τοὺς τότε συμπράττοντας (οὐ γὰρ ἂν δυναίμην), ἀλλὰ τοὺς αὐτοῦ Ἐρατοσθένους ἀκούσαντας. 
47	καίτοι εἰ ἐσωφρόνουν κατεμαρτύρουν ἂν αὐτῶν, καὶ τοὺς διδασκάλους τῶν σφετέρων ἁμαρτημάτων σφόδρʼ ἂν ἐκόλαζον, καὶ τοὺς ὅρκους, εἰ ἐσωφρόνουν, οὐκ ἂν ἐπὶ μὲν τοῖς τῶν πολιτῶν κακοῖς πιστοὺς ἐνόμιζον, ἐπὶ δὲ τοῖς τῆς πόλεως ἀγαθοῖς ῥᾳδίως παρέβαινον· πρὸς μὲν οὖν τούτους τοσαῦτα λέγω, τοὺς δὲ μάρτυράς μοι κάλει. καὶ ὑμεῖς ἀνάβητε. 
48	Μάρτυρες τῶν μὲν μαρτύρων ἀκηκόατε. τὸ δὲ τελευταῖον εἰς τὴν ἀρχὴν καταστὰς ἀγαθοῦ μὲν οὐδενὸς μετέσχεν, ἄλλων δὲ πολλῶν. καίτοι εἴπερ ἦν ἀνὴρ ἀγαθός, ἐχρῆν αὐτὸν αὐτὸν Bekker: ἂν MSS. πρῶτον μὲν μὴ παρανόμως ἄρχειν, ἔπειτα τῇ βουλῇ μηνυτὴν γίγνεσθαι περὶ τῶν εἰσαγγελιῶν ἁπασῶν, ὅτι ψευδεῖς εἶεν, καὶ Βάτραχος καὶ Αἰσχυλίδης οὐ τἀληθῆ μηνύουσιν, ἀλλὰ τὰ ὑπὸ τῶν τριάκοντα πλασθέντα εἰσαγγέλλουσι, συγκείμενα ἐπὶ τῇ τῶν πολιτῶν βλάβῃ. 
49	καὶ μὲν δή, ὦ ἄνδρες δικασταί, ὅσοι κακόνοι ἦσαν τῷ ὑμετέρῳ πλήθει, οὐδὲν ἔλαττον εἶχον σιωπῶντες· ἕτεροι γὰρ ἦσαν οἱ λέγοντες καὶ πράττοντες ὧν οὐχ οἷόν τʼ ἦν μείζω κακὰ γενέσθαι τῇ πόλει. ὁπόσοι δʼ εὖνοί φασιν εἶναι, πῶς οὐκ ἐνταῦθα ἔδειξαν, αὐτοί τε τὰ βέλτιστα λέγοντες καὶ τοὺς ἐξαμαρτάνοντας ἀποτρέποντες; 
50	ἴσως δʼ ἂν ἔχοι εἰπεῖν ὅτι ἐδεδοίκει, καὶ ὑμῶν τοῦτο ἐνίοις ἱκανὸν ἔσται. ὅπως τοίνυν μὴ φανήσεται ἐν τῷ λόγῳ τοῖς τριάκοντα ἐναντιούμενος· εἰ δὲ μή, ἐνταυθοῖ δῆλος ἔσται ὅτι ἐκεῖνά τε αὐτῷ ἤρεσκε, καὶ τοσοῦτον ἐδύνατο ὥστε ἐναντιούμενος μηδὲν κακὸν παθεῖν ὑπʼ αὐτῶν. χρῆν δʼ αὐτὸν ὑπὲρ τῆς ὑμετέρας σωτηρίας ταύτην τὴν προθυμίαν ἔχειν, ἀλλὰ μὴ ὑπὲρ Θηραμένους, ὃς εἰς ὑμᾶς πολλὰ ἐξήμαρτεν. 
51	ἀλλʼ οὗτος τὴν μὲν πόλιν ἐχθρὰν ἐνόμιζεν εἶναι, τοὺς δʼ ὑμετέρους ἐχθροὺς φίλους, ὡς ἀμφότερα ταῦτα ἐγὼ πολλοῖς τεκμηρίοις παραστήσω, καὶ τὰς πρὸς ἀλλήλους διαφορὰς οὐχ ὑπὲρ ὑμῶν ἀλλʼ ὑπὲρ ἑαυτῶν γιγνομένας, ὁπότεροι τὰ πράγματα τὰ πράγματα Gebauer: ταῦτα MSS. πράξουσι καὶ τῆς πόλεως ἄρξουσιν. 
52	εἰ ει Schott: καὶ MSS. γὰρ ὑπὲρ τῶν ἀδικουμένων ἐστασίαζον, ποῦ κάλλιον ἦν ἀνδρὶ ἄρχοντι, ἢ Θρασυβούλου Φυλὴν κατειληφότος, τότε ἐπιδείξασθαι τὴν αὑτοῦ εὔνοιαν εὔνοιαν Markland: συνουσίαν MSS. ; ὁ δʼ ἀντὶ τοῦ ἐπαγγείλασθαί τι ἢ πρᾶξαι ἀγαθὸν πρὸς τοὺς ἐπὶ Φυλῇ, ἐλθὼν μετὰ τῶν συναρχόντων εἰς Σαλαμῖνα καὶ Ἐλευσῖνάδε τριακοσίους τῶν πολιτῶν ἀπήγαγεν εἰς τὸ δεσμωτήριον, καὶ μιᾷ ψήφῳ αὐτῶν ἁπάντων θάνατον κατεψηφίσατο. 
53	ἐπειδὴ δὲ εἰς τὸν Πειραιᾶ ἤλθομεν καὶ αἱ ταραχαὶ γεγενημέναι ἦσαν καὶ περὶ τῶν διαλλαγῶν οἱ λόγοι ἐγίγνοντο, πολλὰς ἑκάτεροι ἐλπίδας εἴχομεν πρὸς ἀλλήλους ἔσεσθαι, ὡς ἀμφότεροι ἔδειξαν. ἔδειξαν Canter: ἔδοξαν MSS. οἱ μὲν γὰρ ἐκ Πειραιῶς κρείττους ὄντες εἴασαν 
54	αὐτοὺς ἀπελθεῖν· οἱ δὲ εἰς τὸ ἄστυ ἐλθόντες τοὺς μὲν τριάκοντα ἐξέβαλον πλὴν Φείδωνος καὶ Ἐρατοσθένους, ἄρχοντας δὲ τοὺς ἐκείνοις ἐχθίστους εἵλοντο, ἡγούμενοι δικαίως ἂν ὑπὸ τῶν αὐτῶν τούς τε τριάκοντα μισεῖσθαι καὶ τοὺς ἐν Πειραιεῖ φιλεῖσθαι. 
55	τούτων τοίνυν Φείδων ὁ τῶν τριάκοντα ὁ τῶν τριάκοντα del. Fronhberger γενόμενος καὶ Ἱπποκλῆς καὶ Ἐπιχάρης ὁ Λαμπτρεὺς καὶ ἕτεροι οἱ δοκοῦντες εἶναι ἐναντιώτατοι Χαρικλεῖ καὶ Κριτίᾳ καὶ τῇ ἐκείνων ἑταιρεία, ἐπειδή αὐτοὶ αὐτοὶ Markland: αὐτοὺς, αὐτοῖς MSS. εἰς τὴν ἀρχὴν κατέστησαν, πολὺ μείζω στάσιν καὶ πόλεμον ἐπὶ τοὺς ἐν Πειραιεῖ ἢ ἤ del. Reiske τοῖς ἐξ ἄστεως ἐποίησαν. 
56	ᾧ καὶ φανερῶς ἐπεδείξαντο ὅτι οὐχ ὑπὲρ τῶν ἐν Πειραιεῖ οὐδʼ ὑπὲρ τῶν ἀδίκως ἀπολλυμένων ἐστασίαζον, οὐδʼ οἱ τεθνεῶτες αὐτοὺς ἐλύπουν οὐδʼ οἱ μέλλοντες ἀποθανεῖσθαι, ἀλλʼ οἱ μεῖζον δυνάμενοι καὶ θᾶττον πλουτοῦντες. 
57	λαβόντες γὰρ τὰς ἀρχὰς καὶ τὴν πόλιν ἀμφοτέροις ἐπολέμουν, τοῖς τε τριάκοντα πάντα κακὰ εἰργασμένοις καὶ ὑμῖν πάντα κακὰ πεπονθόσι. καίτοι τοῦτο πᾶσι δῆλον ἦν, ὅτι εἰ μὲν ἐκεῖνοι δικαίως ἔφευγον, ὑμεῖς ἀδίκως, εἰ δʼ ὑμεῖς δικαίως, οἱ τριάκοντα ἀδίκως ὑμεῖς δικαίως, οἱ τριάκοντα ἀδίκως Reiske: ὑμεῖς ἀδίκως, οἱ τριάκοντα δικαίως MSS. · οὐ γὰρ δὴ δὴ Stephanus: διʼ . ἑτέρων ἔργων αἰτίαν λαβόντες ἐκ τῆς πόλεως ἐξέπεσον, 
58	ἀλλὰ τούτων. ὥστε σφόδρα χρὴ ὀργίζεσθαι, ὅτι Φείδων αἱρεθεὶς ὑμᾶς διαλλάξαι καὶ καταγαγεῖν τῶν αὐτῶν ἔργων Ἐρατοσθένει μετεῖχε καὶ τῇ αὐτῇ γνώμῃ τοὺς μὲν κρείττους αὑτῶν διʼ ὑμᾶς κακῶς ποιεῖν ἕτοιμος ἦν, ὑμῖν δὲ ἀδίκως φεύγουσιν οὐκ ἠθέλησεν ἀποδοῦναι τὴν πόλιν, ἀλλʼ ἐλθὼν εἰς Λακεδαίμονα ἔπειθεν αὐτοὺς στρατεύεσθαι, διαβάλλων ὅτι Βοιωτῶν ἡ πόλις ἔσται, καὶ ἄλλα λέγων οἷ ᾤετο πείσειν μάλιστα. 
59	οὐ δυνάμενος δὲ τούτων τυχεῖν, εἴτε καὶ τῶν ἱερῶν ἐμποδὼν ὄντων εἴτε καὶ αὐτῶν οὐ βουλομένων, ἑκατὸν τάλαντα ἐδανείσατο, ἵνα ἔχοι ἐπικούρους μισθοῦσθαι, καὶ Λύσανδρον ἄρχοντα ᾐτήσατο, εὐνούστατον μὲν ὄντα τῇ ὀλιγαρχίᾳ, κακονούστατον δὲ τῇ πόλει, μισοῦντα δὲ μάλιστα τοὺς ἐν Πειραιεῖ. 
60	μισθωσάμενοι δὲ πάντας ἀνθρώπους ἐπʼ ὀλέθρῳ τῆς πόλεως, καὶ πόλεις ἐπάγοντες, καὶ τελευτῶντες Λακεδαιμονίους καὶ τῶν συμμάχων ὁπόσους ἐδύναντο πεῖσαι, οὐ διαλλάξαι ἀλλʼ ἀπολέσαι παρεσκευάζοντο τὴν πόλιν εἰ μὴ διʼ ἄνδρας ἀγαθούς, οἷς οἷ Taylor: οὓ MSS. ὑμεῖς δηλώσατε παρὰ τῶν ἐχθρῶν δίκην λαβόντες, ὅτι καὶ ἐκείνοις χάριν ἀποδώσετε. 
61	ταῦτα δὲ ἐπίστασθε μὲν καὶ αὐτοί, καὶ οὐκ οὐκ add. Weidner οἶδʼ ὅ τι δεῖ μάρτυρας παρασχέσθαι· ὅμως δέ· ἐγώ τε γὰρ δέομαι ἀναπαύσασθαι, ὑμῶν τʼ ἐνίοις ἥδιον ὡς πλείστων τοὺς αὐτοὺς λόγους ἀκούειν. 
62	Μάρτυρες φέρε δὴ καὶ περὶ Θηραμένους ὡς ἂν δύνωμαι διὰ βραχυτάτων διδάξω. δέομαι δʼ ὑμῶν ἀκοῦσαι ὑπέρ τʼ ἐμαυτοῦ καὶ τῆς πόλεως, καὶ μηδενὶ τοῦτο παραστῇ, ὡς Ἐρατοσθένους κινδυνεύοντος Θηραμένους κατηγορῶ. πυνθάνομαι γὰρ ταῦτα ἀπολογήσεσθαι αὐτόν, ὅτι ἐκείνῳ ἐκείνῳ Taylor: ἐκείνοις MSS. φίλος ἦν καὶ τῶν αὐτῶν ἔργων μετεῖχε. 
63	καίτοι σφόδρʼ ἂν αὐτὸν οἶμαι μετὰ Θεμιστοκλέους πολιτευόμενον προσποιεῖσθαι πράττειν ὅπως οἰκοδομηθήσεται τὰ τείχη, ὁπότε καὶ μετὰ Θηραμένους ὅπως καθαιρεθήσεται. οὐ γάρ μοι δοκοῦσιν ἴσου ἄξιοι γεγενῆσθαι· ὁ μὲν γὰρ Λακεδαιμονίων ἀκόντων ᾠκοδόμησεν αὐτά, οὗτος δὲ τοὺς πολίτας ἐξαπατήσας καθεῖλε. 
64	περιέστηκεν οὖν τῇ πόλει τοὐναντίον ἢ ὡς εἰκὸς ἦν. ἄξιον μὲν γὰρ ἦν ἦ add. Reiske καὶ τοὺς φίλους τοὺς τοὺς Franz: τοῦ MSS. Θηραμένους προσαπολωλέναι, πλὴν εἴ τις ἐτύγχανεν ἐκείνῳ τἀναντία πράττων· νῦν δὲ ὁρῶ τάς τε ἀπολογίας εἰς ἐκεῖνον ἀναφερομένας, τούς τʼ ἐκείνῳ συνόντας τιμᾶσθαι πειρωμένους, ὥσπερ πολλῶν ἀγαθῶν αἰτίου ἀλλʼ οὐ μεγάλων κακῶν γεγενημένου. αἰτίου γεγενημένου Bekker: αἰτίους γεγενημένους MSS. 
65	ὃς πρῶτον μὲν τῆς προτέρας ὀλιγαρχίας αἰτιώτατος ἐγένετο, πείσας ὑμᾶς τὴν ἐπὶ τῶν τετρακοσίων πολιτείαν ἑλέσθαι. καὶ ὁ μὲν πατὴρ αὐτοῦ τῶν προβούλων ὢν ταὔτʼ ἔπραττεν, αὐτὸς δὲ δοκῶν εὐνούστατος εἶναι τοῖς πράγμασι στρατηγὸς ὑπʼ αὐτῶν αὐτῶν Sauppe: αὐτοῦ MSS. ᾑρέθη. 
66	καὶ ἕως μὲν ἐτιμᾶτο, πιστὸν ἑαυτὸν τῇ πόλει τῂ πόλει del. Dobree παρεῖχεν· ἐπειδὴ δὲ Πείσανδρον μὲν καὶ Κάλλαισχρον καὶ ἑτέρους ἑώρα προτέρους αὑτοῦ γιγνομένους, τὸ δὲ ὑμέτερον πλῆθος οὐκέτι βουλόμενον τούτων ἀκροᾶσθαι, τότʼ ἤδη διά τε τὸν πρὸς ἐκείνους φθόνον καὶ τὸ παρʼ ὑμῶν δέος μετέσχε τῶν Ἀριστοκράτους ἔργων. 
67	βουλόμενος δὲ τῷ ὑμετέρῳ πλήθει δοκεῖν πιστὸς εἶναι Ἀντιφῶντα καὶ Ἀρχεπτόλεμον φιλτάτους ὄντας αὑτῷ κατηγορῶν ἀπέκτεινεν, εἰς τοσοῦτον δὲ κακίας ἦλθεν, ὥστε ἅμα μὲν διὰ τὴν πρὸς ἐκείνους πίστιν ὑμᾶς κατεδουλώσατο, διὰ δὲ τὴν πρὸς ὑμᾶς τοὺς φίλους ἀπώλεσε. 
68	τιμώμενος δὲ καὶ τῶν μεγίστων ἀξιούμενος, αὐτὸς ἐπαγγειλάμενος σώσειν τὴν πόλιν αὐτὸς ἀπώλεσε, φάσκων πρᾶγμα ηὑρηκέναι μέγα καὶ πολλοῦ ἄξιον. ὑπέσχετο δὲ εἰρήνην ποιήσειν μήτε ὅμηρα δοὺς μήτε τὰ τείχη καθελὼν μήτε τὰς ναῦς παραδούς· ταῦτα δὲ εἰπεῖν μὲν οὐδενὶ ἠθέλησεν, ἐκέλευσε δὲ αὑτῷ πιστεύειν. 
69	ὑμεῖς δέ, ὦ ἄνδρες Ἀθηναῖοι, πραττούσης μὲν τῆς ἐν Ἀρείπάγῳ βουλῆς σωτήρια, σωτήρια Marklans : σωτηρίαν MSS ἀντιλεγόντων δὲ πολλῶν Θηραμένει, εἰδότες δὲ ὅτι οἱ μὲν ἄλλοι ἄνθρωποι τῶν πολεμίων ἕνεκα τἀπόρρητα ποιοῦνται, ἐκεῖνος δʼ ἐν τοῖς αὑτοῦ πολίταις οὐκ ἠθέλησεν εἰπεῖν ταῦθʼ ἃ πρὸς τοὺς πολεμίους ἔμελλεν ἐρεῖν, ὅμως ἐπετρέψατε αὐτῷπατρίδα καὶ παῖδας καὶ γυναῖκας καὶ ὑμᾶς αὐτούς. ὁ δὲ ὧν μὲν ὑπέσχετο οὐδὲν ἔπραξεν, 
70	οὕτως δὲ ἐνετεθύμητο ὡς χρὴ μικρὰν καὶ ἀσθενῆ γενέσθαι τὴν πόλιν, ὥστε περὶ ὧν οὐδεὶς πώποτε οὔτε τῶν πολεμίων ἐμνήσθη οὔτε τῶν πολιτῶν ἤλπισε, ταῦθʼ ὑμᾶς ἔπεισε πρᾶξαι, οὐχ ὑπὸ Λακεδαιμονίων ἀναγκαζόμενος, ἀλλʼ αὐτὸς αὐτὸς Canter: αὐτοῖς MSS. ἐκείνοις ἐπαγγελλόμενος, τοῦ τε Πειραιῶς τὰ τείχη περιελεῖν καὶ τὴν ὑπάρχουσαν πολιτείαν καταλῦσαι, εὖ εἰδὼς ὅτι, εἰ μὴ πασῶν τῶν ἐλπίδων ἀποστερηθήσεσθε, ταχεῖαν παρʼ αὐτοῦ τὴν τιμωρίαν κομιεῖσθε. 
71	καὶ τὸ τελευταῖον, ὦ ἄνδρες δικασταί, οὐ πρότερον εἴασε τὴν ἐκκλησίαν γενέσθαι, ἕως ὁ λεγόμενος ὑπʼ ἐκείνων ἐκείνων Markland: ἐκείνου MSS. καιρὸς ἐπιμελῶς ὑπʼ αὐτοῦ ἐτηρήθη, καὶ μετεπέμψατο μὲν τὰς μετὰ Λυσάνδρου ναῦς ἐκ Σάμου, ἐπεδήμησε δὲ τὸ τῶν πολεμίων στρατόπεδον. 
72	τότε δὲ τούτων ὑπαρχόντων, καὶ παρόντος Λυσάνδρου καὶ Φιλοχάρους καὶ Μιλτιάδου, περὶ τῆς πολιτείας τὴν ἐκκλησίαν ἐποίουν, ἵνα μήτε ῥήτωρ αὐτοῖς μηδεὶς ἐναντιοῖτο μηδὲ διαπειλοῖτο διαπειλοῖτο Cobet: ἀπειλοῖτο MSS. ὑμεῖς τε μὴ τὰ τῆ πόλει συμφέροντα ἕλοισθε, ἀλλὰ τἀκείνοις δοκοῦντα ψηφίσαισθε. 
73	ἀναστὰς δὲ Θηραμένης ἐκέλευσεν ὑμᾶς τριάκοντα ἀνδράσιν ἐπιτρέψαι τὴν πόλιν καὶ τῇ πολιτεία χρῆσθαι ἣν Δρακοντίδης ἀπέφαινεν. ὑμεῖς δʼ ὅμως καὶ οὕτω διακείμενοι ἐθορυβεῖτε ὡς οὐ ποιήσοντες ταῦτα· ἐγιγνώσκετε γὰρ ὅτι περὶ δουλείας καὶ ἐλευθερίας ἐν ἐκείνῃ τῇ ἡμέρα ἠκκλησιάζετε. 
74	θηραμένης δέ, ὦ ἄνδρες δικασταί, (καὶ τούτων ὑμᾶς αὐτοὺς μάρτυρας παρέξομαι) εἶπεν ὅτι οὐδὲν αὐτῷ μέλοι τοῦ ὑμετέρου θορύβου, ἐπειδὴ πολλοὺς μὲν Ἀθηναίων εἰδείη τοὺς τὰ ὅμοια πράττοντας αὑτῷ, δοκοῦντα δὲ Λυσάνδρῳ καὶ Λακεδαιμονίοις λέγοι. μετʼ ἐκεῖνον δὲ Λύσανδρος ἀναστὰς ἄλλα τε πολλὰ εἶπε καὶ ὅτι παρασπόνδους ὑμᾶς ἔχοι, καὶ ὅτι οὐ περὶ πολιτείας ὑμῖν ἔσται ἀλλὰ περὶ σωτηρίας, εἰ μὴ ποιήσεθʼ ποιήσεθʼ Cobet: ποιήσαιθʼ . ἃ Θηραμένης κελεύει. 
75	τῶν δʼ ἐν τῇ ἐκκλησία ὅσοι ἄνδρες ἀγαθοὶ ἦσαν, γνόντες τὴν παρασκευὴν καὶ τὴν ἀνάγκην, οἱ μὲν αὐτοῦ μένοντες ἡσυχίαν ἦγον, οἱ δὲ ᾤχοντο ἀπιόντες, τοῦτο γοῦν σφίσιν αὐτοῖς συνειδότες, ὅτι οὐδὲν κακὸν τῇ πόλει ἐψηφίσαντο· ὀλίγοι δέ τινες καὶ πονηροὶ καὶ κακῶς βουλευόμενοι τὰ προσταχθέντα ἐχειροτόνησαν. 
76	παρήγγελτο παρήγγελτο Cobet: παρηγγέλλετο MSS. γὰρ αὐτοῖς δέκα μὲν οὓς Θηραμένης ἀπέδειξε χειροτονῆσαι, δέκα δὲ οὓς οἱ καθεστηκότες ἔφοροι κελεύοιεν, δέκα δʼ ἐκ τῶν παρόντων· οὕτω γὰρ τὴν ὑμετέραν ἀσθένειαν ἑώρων καὶ τὴν αὑτῶν δύναμιν ἠπίσταντο, ὥστε πρότερον ᾔδεσαν τὰ μέλλοντα ἐν τῇ ἐκκλησία πραχθήσεσθαι. 
77	ταῦτα δὲ οὐκ ἐμοὶ δεῖ πιστεῦσαι, ἀλλὰ ἐκείνῳ· πάντα γὰρ τὰ ὑπʼ ἐμοῦ εἰρημένα ἐν τῇ βουλῇ ἀπολογούμενος ἔλεγεν, ὀνειδίζων μὲν τοῖς φεύγουσιν, ὅτι διʼ αὑτὸν κατέλθοιεν, οὐδὲν φροντιζόντων φροντιζόντων Dobree: φροντίζων δὲ τῶν . Λακεδαιμονίων, ὀνειδίζων δὲ τοῖς τῆς πολιτείας μετέχουσιν, ὅτι πάντων τῶν πεπραγμένων τοῖς εἰρημένοις τρόποις ὑπʼ ἐμοῦ αὐτὸς αἴτιος γεγενημένος τοιούτων τυγχάνοι, πολλὰς πίστεις αὐτοῖς ἔργῳ δεδωκὼς καὶ παρʼ ἐκείνων ὅρκους εἰληφώς. 
78	καὶ τοσούτων καὶ ἑτέρων κακῶν καὶ αἰσχρῶν καὶ πάλαι καὶ νεωστὶ καὶ μικρῶν καὶ μεγάλων αἰτίου γεγενημένου αἰτίου γεγενημένου Reiske: αἴτιοι γεγενημένοι . τολμήσουσιν αὑτοὺς φίλους ὄντας ἀποφαίνειν, οὐχ ὑπὲρ ὑμῶν ἀποθανόντος Θηραμένους ἀλλʼ ὑπὲρ τῆς αὑτοῦ πονηρίας, καὶ δικαίως μὲν ἐν ὀλιγαρχίᾳ δίκην δόντος (ἤδη γὰρ αὐτὴν κατέλυσε), δικαίως δʼ ἂν ἐν δημοκρατίᾳ· δὶς γὰρ ὑμᾶς κατεδουλώσατο, τῶν μὲν παρόντων καταφρονῶν, τῶν δὲ ἀπόντων ἐπιθυμῶν, καὶ τῷ καλλίστῳ ὀνόματι χρώμενος δεινοτάτων ἔργων διδάσκαλος καταστάς. 
79	περὶ μὲν τοίνυν Θηραμένους ἱκανά μοί ἐστι τὰ κατηγορημένα· ἥκει δʼ ὑμῖν ἐκεῖνος ὁ καιρός, ἐν ᾧ δεῖ συγγνώμην καὶ ἔλεον μὴ εἶναι ἐν ταῖς ὑμετέραις γνώμαις, ἀλλὰ παρὰ Ἐρατοσθένους καὶ τῶν τούτου συναρχόντων δίκην λαβεῖν, μηδὲ μαχομένους μὲν μὲν add. Contius κρείττους εἶναι τῶν πολεμίων, ψηφιζομένους δὲ ἥττους τῶν ἐχθρῶν. 
80	μηδʼ ὧν φασι μέλλειν πράξειν πλείω χάριν αὐτοῖς ἴστε, ἢ ὧν ἐποίησαν ὀργίζεσθε· μηδʼ ἀποῦσι μὲν τοῖς τριάκοντα ἐπιβουλεύετε, παρόντας δʼ ἀφῆτε· μηδὲ τῆς τύχης, ἣ τούτους παρέδωκε τῇ πόλει, κάκιον ὑμῖν αὐτοῖς βοηθήσητε. 
