81	κατηγόρηται κατηγόρηται Bake: κατηγορεῖτε MSS. δὴ Ἐρατοσθένους καὶ τῶν τούτου φίλων, οἷς τὰς ἀπολογίας ἀνοίσει καὶ μεθʼ ὧν αὐτῷ ταῦτα πέπρακται. ὁ μέντοι ἀγὼν οὐκ ἐξ ἴσου τῇ πόλει καὶ Ἐρατοσθένει· οὗτος μὲν γὰρ κατήγορος καὶ δικαστὴς αὑτὸς ἦν τῶν κρινομένων, ἡμεῖς δὲ νυνὶ εἰς κατηγορίαν καὶ ἀπολογίαν καθέσταμεν. 
82	καὶ καὶ Dobree: καίτοι MSS. οὗτοι μὲν τοὺς οὐδὲν ἀδικοῦντας ἀκρίτους ἀπέκτειναν, ὑμεῖς δὲ τοὺς ἀπολέσαντας τὴν πόλιν κατὰ τὸν νόμον ἀξιοῦτε κρίνειν, παρʼ ὧν οὐδʼ ἂν παρανόμως βουλόμενοι δίκην λαμβάνειν ἀξίαν τῶν ἀδικημάτων ὧν τὴν πόλιν ἠδικήκασι λάβοιτε. τί γὰρ ἂν παθόντες δίκην τὴν ἀξίαν εἴησαν τῶν ἔργων δεδωκότες; 
83	πότερον εἰ αὐτοὺς ἀποκτείναιτε καὶ τοὺς παῖδας αὐτῶν, ἱκανὴν ἂν τοῦ φόνου δίκην λάβοιμεν, ὧν οὗτοι πατέρας καὶ ὑεῖς καὶ ἀδελφοὺς ἀκρίτους ἀπέκτειναν; ἀλλὰ εἰ τὰ χρήματα τὰ φανερὰ δημεύσαιτε, δημεύσαιτε Reiske: δημεύσετε MSS. καλῶς ἂν ἔχοι ἢ τῇ πόλει, ἧς οὗτοι πολλὰ εἰλήφασιν, ἢ τοῖς ἰδιώταις, 
84	ὧν τὰς τὰς add. Scheibe οἰκίας ἐξεπόρθησαν; ἐπειδὴ τοίνυν πάντα ποιοῦντες δίκην παρʼ αὐτῶν τὴν ἀξίαν τὴν ἀξίαν add. Gebauer οὐκ ἂν δύναισθε δύναισθε Bekker: δύνησθε MSS. λαβεῖν, πῶς οὐκ αἰσχρὸν ὑμῖν καὶ ἡντινοῦν ἀπολιπεῖν, ἥντινά τις βούλοιτο παρὰ τούτων λαμβάνειν; πᾶν δʼ ἄν μοι δοκεῖ τολμῆσαι, ὅστις νυνὶ οὐχ ἑτέρων ὄντων τῶν δικαστῶν ἀλλʼ αὐτῶν τῶν κακῶς πεπονθότων, ἥκει ἀπολογησόμενος πρὸς αὐτοὺς τοὺς μάρτυρας τῆς τούτου πονηρίας· τοσοῦτον ἢ ὑμῶν καταπεφρόνηκεν ἢ ἑτέροις πεπίστευκεν. 
85	ὧν ἀμφοτέρων ἄξιον ἐπιμεληθῆναι, ἐνθυμουμένους ὅτι οὔτʼ ἂν ἐκεῖνα ἐδύναντο ἐδύναντο Markland: δύναιντο MSS. ποιεῖν μὴ ἑτέρων συμπραττόντων οὔτʼ ἂν νῦν ἐπεχείρησαν ἐλθεῖν μὴ ὑπὸ τῶν αὐτῶν οἰόμενοι σωθήσεσθαι, οἳ οὐ τούτοις ἥκουσι βοηθήσοντες, ἀλλὰ ἡγούμενοι πολλὴν ἄδειαν σφίσιν ἔσεσθαι τῶν τε τε add. Reiske πεπραγμένων καὶ τοῦ λοιποῦ ποιεῖν ὅ τι ἂν βούλωνται, εἰ τοὺς μεγίστων κακῶν αἰτίους λαβόντες ἀφήσετε. 
86	ἀλλὰ καὶ τῶν συνερούντων συνερούντων Reiske: ξυνεργούντων MSS. αὐτοῖς ἄξιον θαυμάζειν, πότερον ὡς καλοὶ κἀγαθοὶ αἰτήσονται, τὴν αὑτῶν ἀρετὴν πλείονος ἀξίαν ἀποφαίνοντες τῆς τούτων τούτων add. Markland πονηρίας· ἐβουλόμην μέντʼ ἂν αὐτοὺς οὕτω προθύμους εἶναι σῴζειν τὴν πόλιν, ὥσπερ οὗτοι ἀπολλύναι ἀπολλύναι Markland: ἀποδοῦναι MSS. ἢ ὡς δεινοὶ λέγειν ἀπολογήσονται καὶ τὰ τούτων ἔργα πολλοῦ ἄξια ἀποφανοῦσιν. ἀλλʼ οὐχ ὑπὲρ ὑμῶν οὐδεὶς αὐτῶν οὐδὲ τὰ δίκαια πώποτε ἐπεχείρησεν εἰπεῖν. 
87	ἀλλὰ τοὺς μάρτυρας ἄξιον ἰδεῖν, οἳ τούτοις μαρτυροῦντες αὑτῶν κατηγοροῦσι, σφόδρα ἐπιλήσμονας καὶ εὐήθεις νομίζοντες ὑμᾶς εἶναι, εἰ διὰ μὲν τοῦ ὑμετέρου πλήθους ἀδεῶς ἡγοῦνται τοὺς τριάκοντα σώσειν, διὰ δὲ Ἐρατοσθένην καὶ τοὺς συνάρχοντας αὐτοῦ δεινὸν ἦν καὶ τῶν τεθνεώτων ἐπʼ ἐκφορὰν ἐλθεῖν. 
88	καίτοι οὗτοι μὲν σωθέντες πάλιν ἂν δύναιντο τὴν πόλιν ἀπολέσαι· ἐκεῖνοι δέ, οὓς οὗτοι ἀπώλεσαν, τελευτήσαντες τὸν βίον πέρας ἔχουσι τῆς παρὰ τῶν ἐχθρῶν τιμωρίας. οὐκ οὖν δεινὸν εἰ τῶν μὲν ἀδίκως τεθνεώτων οἱ φίλοι συναπώλλυντο, αὐτοῖς δὲ τοῖς τὴν πόλιν ἀπολέσασι δήπου δήπου Sauppe : ἦπου MSS ἐπʼ ἐκφορὰν πολλοὶ ἥξουσιν, ὁπότε βοηθεῖν τοσοῦτοι παρασκευάζονται; 
89	καὶ μὲν δὴ πολλῷ ῥᾷον ἡγοῦμαι εἶναι ὑπὲρ ὧν ὑμεῖς ἐπάσχετε ἀντειπεῖν, ἢ ὑπὲρ ὧν οὗτοι πεποιήκασιν ἀπολογήσασθαι. καίτοι λέγουσιν ὡς Ἐρατοσθένει ἐλάχιστα τῶν τριάκοντα κακὰ εἴργασται, καὶ διὰ τοῦτο αὐτὸν ἀξιοῦσι σωθῆναι· ὅτι δὲ τῶν ἄλλων Ἑλλήνων πλεῖστα εἰς ὑμᾶς ἐξημάρτηκεν, 
90	οὐκ οἴονται χρῆναι αὐτὸν ἀπολέσθαι; ὑμεῖς δὲ δείξατε ἥντινα γνώμην ἔχετε περὶ τῶν πραγμάτων. εἰ μὲν γὰρ τούτου καταψηφιεῖσθε, δῆλοι ἔσεσθε ὡς ὀργιζόμενοι τοῖς πεπραγμένοις· εἰ δὲ ἀποψηφιεῖσθε, ὀφθήσεσθε τῶν αὐτῶν ἔργων ἐπιθυμηταὶ τούτοις ὄντες, καὶ οὐχ ἕξετε λέγειν ὅτι τὰ ὑπὸ τῶν τριάκοντα 
91	προσταχθέντα ἐποιεῖτε· νυνὶ μὲν γὰρ οὐδεὶς ὑμᾶς ἀναγκάζει παρὰ τὴν ὑμετέραν γνώμην ψηφίζεσθαι. ψηφίζεσθηαι Bekker: ἀποψηφίζεσθηαι MSS ὥστε συμβουλεύω μὴ τούτων ἀποψηφισαμένους ὑμῶν αὐτῶν καταψηφίσασθαι. μηδʼ οἴεσθε κρύβδην τὴν ψῆφον εἶναι φανερὰν γὰρ τῇ πόλει τὴν ὑμετέραν γνώμην ποιήσετε. 
92	βούλομαι δὲ ὀλίγα ἑκατέρους ἀναμνήσας καταβαίνειν, τούς τε ἐξ ἄστεως καὶ τοὺς ἐκ Πειραιῶς, ἵνα τὰς ὑμῖν τούτων γεγενημένας συμφορὰς παραδείγματα ἔχοντες τὴν ψῆφον φέρητε. καὶ πρῶτον μὲν ὅσοι ἐξ ἄστεώς ἐστε, σκέψασθε ὅτι ὑπὸ τούτων οὕτω σφόδρα ἤρχεσθε, ὥστε ἀδελφοῖς καὶ ὑέσι καὶ πολίταις ἠναγκάζεσθε πολεμεῖν τοιοῦτον πόλεμον, ἐν ᾧ ἡττηθέντες μὲν τοῖς νικήσασι τὸ ἴσον ἔχετε, νικήσαντες δʼ ἄν τούτοις ἐδουλεύετε. 
93	καὶ τοὺς ἰδίους οἴκους οὗτοι μὲν ἂν ἃν del. Baiter ἐκ τῶν πραγμάτων μεγάλους ἐκτήσαντο, ὑμεῖς δὲ διὰ τὸν πρὸς ἀλλήλους πόλεμον ἐλάττους ἔχετε· συνωφελεῖσθαι μὲν γὰρ ὑμᾶς οὐκ ἠξίουν, συνδιαβάλλεσθαι δʼ ἠνάγκαζον, εἰς τοσοῦτον ὑπεροψίας ἐλθόντες ὥστε οὐ τῶν ἀγαθῶν κοινούμενοι πιστοὺς ὑμᾶς ἐκτῶντο, ἀλλὰ τῶν ὀνειδῶν μεταδιδόντες εὔνους ὤοντο εἶναι. 
94	ἀνθʼ ὧν ὑμεῖς νῦν ἐν τῷ θαρραλέῳ ὄντες, καθʼ ὅσον δύνασθε, καὶ ὑπὲρ ὑμῶν αὐτῶν καὶ ὑπὲρ τῶν ἐκ Πειραιῶς τιμωρήσασθε, ἐνθυμηθέντες μὲν ὅτι ὑπὸ τούτων πονηροτάτων πονηροτάτων Reiske: πονηροτέρων MSS. ὄντων ἤρχεσθε, ἐνθυμηθέντες δὲ ὅτι μετʼ ἀνδρῶν νῦν ἀρίστων πολιτεύεσθε καὶ τοῖς πολεμίοις μάχεσθε καὶ περὶ τῆς πόλεως βουλεύεσθε, ἀναμνησθέντες δὲ τῶν ἐπικούρων, οὓς οὗτοι φύλακας τῆς σφετέρας σφετέρας Markland: ὑμετέρας MSS. ἀρχῆς καὶ τῆς ὑμετέρας δουλείας εἰς τὴν ἀκρόπολιν κατέστησαν. 
95	καὶ πρὸς ὑμᾶς μὲν ἔτι πολλῶν ὄντων εἰπεῖν τοσαῦτα λέγω. ὅσοι δʼ ἐκ Πειραιῶς ἐστε, πρῶτον μὲν τῶν ὅπλων ἀναμνήσθητε, ὅτι πολλὰς μάχας ἐν τῇ ἀλλοτρίᾳ μαχεσάμενοι οὐχ ὑπὸ τῶν πολεμίων ἀλλʼ ὑπὸ τούτων εἰρήνης οὔσης ἀφῃρέθητε τὰ ὅπλα, ἔπειθʼ ὅτι ἐξεκηρύχθητε μὲν ἐκ τῆς πόλεως, ἣν ὑμῖν οἱ πατέρες παρέδοσαν, φεύγοντας δὲ ὑμᾶς ἐκ τῶν πόλεων ἐξῃτοῦντο. ἑξῃτοῦντο Contius: ἐζῃτοῦντο MSS. 
96	ἀνθʼ ὧν ὀργίσθητε μὲν ὥσπερ ὅτʼ ἐφεύγετε, ἀναμνήσθητε δὲ καὶ τῶν ἄλλων κακῶν ἃ πεπόνθατε ὑπʼ αὐτῶν, οἳ τοὺς μὲν ἐκ τῆς ἀγορᾶς τοὺς δʼ ἐκ τῶν ἱερῶν συναρπάζοντες βιαίως ἀπέκτειναν, ἀπέκτειναν Reiske: ἀπέκτενον MSS. τοὺς δὲ ἀπὸ τέκνων καὶ γονέων καὶ γυναικῶν ἀφέλκοντες ἀφέλκοντες Reiske: ἀφελόντες MSS. φονέας αὑτῶν ἠνάγκασαν γενέσθαι καὶ οὐδὲ ταφῆς τῆς νομιζομένης εἴασαν τυχεῖν, ἡγούμενοι τὴν αὑτῶν ἀρχὴν βεβαιοτέραν εἶναι τῆς παρὰ τῶν θεῶν τιμωρίας. ὅσοι δὲ τὸν θάνατον διέφυγον, 
97	πολλαχοῦ κινδυνεύσαντες καὶ εἰς πολλὰς πόλεις πλανηθέντες καὶ πανταχόθεν ἐκκηρυττόμενοι, ἐνδεεῖς ὄντες τῶν ἐπιτηδείων, οἱ μὲν ἐν πολεμίᾳ τῇ πατρίδι τοὺς παῖδας καταλιπόντες, οἱ δʼ ἐν ξένῃ γῇ, πολλῶν ἐναντιουμένων ἤλθετε εἰς τὸν Πειραιᾶ. πολλῶν δὲ καὶ μεγάλων κινδύνων ὑπαρξάντων ἄνδρες ἀγαθοὶ γενόμενοι τοὺς μὲν ἠλευθερώσατε, τοὺς δʼ εἰς τὴν πατρίδα κατηγάγετε. 
98	εἰ δὲ ἐδυστυχήσατε καὶ τούτων ἡμάρτετε, αὐτοὶ μὲν ἂν δείσαντες ἐφεύγετε μὴ πάθητε τοιαῦτα οἷα καὶ πρότερον, καὶ οὔτʼ ἂν ἱερὰ οὔτε βωμοὶ ὑμᾶς ἀδικουμένους διὰ τοὺς τούτων τρόπους ὠφέλησαν, ἃ καὶ τοῖς ἀδικοῦσι σωτήρια γίγνεται· οἱ δὲ παῖδες ὑμῶν, ὅσοι μὲν ἐνθάδε ἦσαν, ὑπὸ τούτων ἂν ὑβρίζοντο, οἱ δʼ ἐπὶ ξένης μικρῶν ἂν ἕνεκα συμβολαίων ἐδούλευον ἐρημίᾳ τῶν ἐπικουρησόντων. 
99	ἀλλὰ γὰρ οὐ τὰ μέλλοντα ἔσεσθαι βούλομαι λέγειν, τὰ πραχθέντα ὑπὸ τούτων οὐ δυνάμενος εἰπεῖν. οὐδὲ γὰρ ἑνὸς κατηγόρου οὐδὲ δυοῖν ἔργον ἐστίν, ἀλλὰ πολλῶν. ὅμως δὲ τῆς ἐμῆς προθυμίας οὐδὲν οὐδὲν add. Canter ἐλλέλειπται, ὑπέρ τε τε add. Sauppe τῶν ἱερῶν, ἃ οὗτοι τὰ μὲν ἀπέδοντο τὰ δʼ εἰσιόντες ἐμίαινον, ὑπέρ τε τῆς πόλεως, ἣν μικρὰν ἐποίουν, ὑπέρ τε τῶν νεωρίων, ἃ καθεῖλον, καὶ ὑπὲρ τῶν τεθνεώτων, οἷς ὑμεῖς, ἐπειδὴ ζῶσιν ἐπαμῦναι οὐκ ἐδύνασθε, ἀποθανοῦσι βοηθήσατε. 
100	οἶμαι δʼ αὐτοὺς ἡμῶν ἡμῶν Auger: ὑμῶν MSS. τε ἀκροᾶσθαι καὶ ὑμᾶς εἴσεσθαι τὴν ψῆφον φέροντας, ἡγουμένους, ὅσοι μὲν ἂν τούτων ἀποψηφίσησθε, αὐτῶν θάνατον κατεψηφισμένους ἔσεσθαι, κατεψηφισμένους ἔσεσθαι Kayser: καταψηφιεῖσθαι MSS. ὅσοι δʼ ἂν παρὰ τούτων δίκην λάβωσιν, ὑπὲρ αὐτῶν τιμωρίας πεποιημένους. παύσομαι κατηγορῶν. ἀκηκόατε, ἑωράκατε, πεπόνθατε, ἔχετε· δικάζετε. 
